budget,genres,homepage,id,keywords,original_language,original_title,overview,popularity,production_companies,production_countries,release_date,revenue,runtime,spoken_languages,status,tagline,title,vote_average,vote_count
28000000,"[{""id"": 10749, ""name"": ""Romance""}]",,112949,"[{""id"": 818, ""name"": ""based on novel""}, {""id"": 1415, ""name"": ""small town""}, {""id"": 33476, ""name"": ""widower""}, {""id"": 33479, ""name"": ""single father""}, {""id"": 212643, ""name"": ""abusive husband""}]",en,Safe Haven,"A young woman with a mysterious past lands in Southport, North Carolina where her bond with a widower forces her to confront the dark secret that haunts her.",37.729059,"[{""name"": ""Temple Hill Productions"", ""id"": 722}, {""name"": ""Relativity Media"", ""id"": 7295}]","[{""iso_3166_1"": ""US"", ""name"": ""United States of America""}]",2/7/2013,97594140,115,"[{""iso_639_1"": ""en"", ""name"": ""English""}, {""iso_639_1"": ""pt"", ""name"": ""Portugu\u00eas""}]",Released,You know it when you find it,Safe Haven,6.9,823
22000000,"[{""id"": 35, ""name"": ""Comedy""}]",,11453,"[{""id"": 437, ""name"": ""painter""}, {""id"": 587, ""name"": ""amsterdam""}, {""id"": 630, ""name"": ""dolphin""}, {""id"": 1295, ""name"": ""europe""}, {""id"": 1667, ""name"": ""pimp""}, {""id"": 2699, ""name"": ""fetish""}, {""id"": 3248, ""name"": ""gigolo""}, {""id"": 34112, ""name"": ""wig""}, {""id"": 41327, ""name"": ""snorkel""}, {""id"": 41328, ""name"": ""whistle""}]",en,Deuce Bigalow: European Gigolo,Deuce Bigalow goes to Amsterdam after a little accident including two irritating kids and a bunch of aggressive dolphins. There he meets up with his old friend T.J. Hicks. But a mysterious killer starts killing some of Amsterdam's finest gigolos and T.J. is mistaken for the extremely gay murderer. Deuce must enter the gigolo industry again to find the real murderer and clear T.J.'s name.,10.259461,"[{""name"": ""Columbia Pictures Corporation"", ""id"": 441}, {""name"": ""Out of the Blue... Entertainment"", ""id"": 879}, {""name"": ""Happy Madison Productions"", ""id"": 2608}]","[{""iso_3166_1"": ""US"", ""name"": ""United States of America""}]",8/6/2005,22400154,83,"[{""iso_639_1"": ""nl"", ""name"": ""Nederlands""}, {""iso_639_1"": ""en"", ""name"": ""English""}, {""iso_639_1"": ""pl"", ""name"": ""Polski""}, {""iso_639_1"": ""pt"", ""name"": ""Portugu\u00eas""}]",Released,For the women of Europe... The price of love just got a lot cheaper.,Deuce Bigalow: European Gigolo,4.7,225
5000000,"[{""id"": 27, ""name"": ""Horror""}, {""id"": 53, ""name"": ""Thriller""}]",http://www.stayinyourroom.com/,298312,"[{""id"": 897, ""name"": ""rap music""}, {""id"": 904, ""name"": ""pennsylvania""}, {""id"": 1155, ""name"": ""brother sister relationship""}, {""id"": 4932, ""name"": ""farm""}, {""id"": 9229, ""name"": ""grandparents""}, {""id"": 9826, ""name"": ""murder""}, {""id"": 10103, ""name"": ""children""}, {""id"": 10183, ""name"": ""independent film""}, {""id"": 13127, ""name"": ""farmhouse""}, {""id"": 14768, ""name"": ""single mother""}, {""id"": 14819, ""name"": ""violence""}, {""id"": 160841, ""name"": ""oven""}, {""id"": 163053, ""name"": ""found footage""}, {""id"": 172664, ""name"": ""hide and seek""}, {""id"": 200283, ""name"": ""diaper""}]",en,The Visit,"The terrifying story of a brother and sister who are sent to their grandparents' remote Pennsylvania farm for a weeklong trip. Once the children discover that the elderly couple is involved in something deeply disturbing, they see their chances of getting back home are growing smaller every day.",38.94708,"[{""name"": ""Blumhouse Productions"", ""id"": 3172}, {""name"": ""Blinding Edge Pictures"", ""id"": 12236}]","[{""iso_3166_1"": ""US"", ""name"": ""United States of America""}]",9/10/2015,98450062,94,"[{""iso_639_1"": ""en"", ""name"": ""English""}]",Released,No one loves you like your grandparents.,The Visit,6,1360
110000000,"[{""id"": 28, ""name"": ""Action""}, {""id"": 10752, ""name"": ""War""}]",http://www.300themovie.com/,53182,"[{""id"": 18712, ""name"": ""based on graphic novel""}, {""id"": 162861, ""name"": ""ancient greece""}, {""id"": 179431, ""name"": ""duringcreditsstinger""}, {""id"": 182677, ""name"": ""sea battle""}, {""id"": 188955, ""name"": ""hand to hand combat""}, {""id"": 190999, ""name"": ""minions""}, {""id"": 195862, ""name"": ""naval warfare""}, {""id"": 209714, ""name"": ""3d""}]",en,300: Rise of an Empire,"Based on Frank Miller's latest graphic novel Xerxes and told in the breathtaking visual style of the blockbuster ""300,"" this new chapter of the epic saga takes the action to a fresh battlefield--on the sea--as Greek general Themistokles attempts to unite all of Greece by leading the charge that will change the course of the war. ""300: Rise of an Empire"" pits Themistokles against the massive invading Persian forces led by mortal-turned-god Xerxes and Artemesia, the vengeful commander of the Persian navy.",71.510596,"[{""name"": ""Legendary Pictures"", ""id"": 923}, {""name"": ""Hollywood Gang Productions"", ""id"": 2994}, {""name"": ""Atmosphere Entertainment MM"", ""id"": 2995}, {""name"": ""Warner Bros."", ""id"": 6194}, {""name"": ""Nimar Studios"", ""id"": 7636}, {""name"": ""Cruel and Unusual Films"", ""id"": 78685}]","[{""iso_3166_1"": ""US"", ""name"": ""United States of America""}]",3/5/2014,337580051,102,"[{""iso_639_1"": ""en"", ""name"": ""English""}]",Released,Seize your glory!,300: Rise of an Empire,6.1,2397
12000000,"[{""id"": 35, ""name"": ""Comedy""}, {""id"": 80, ""name"": ""Crime""}]",,57214,"[{""id"": 2016, ""name"": ""vandalism""}, {""id"": 6270, ""name"": ""high school""}, {""id"": 8181, ""name"": ""swimming pool""}, {""id"": 8508, ""name"": ""party""}, {""id"": 11870, ""name"": ""teen movie""}, {""id"": 13130, ""name"": ""teenager""}, {""id"": 15162, ""name"": ""dog""}, {""id"": 33910, ""name"": ""high school student""}, {""id"": 160517, ""name"": ""fake documentary""}, {""id"": 171134, ""name"": ""sex doll""}, {""id"": 182145, ""name"": ""lime""}, {""id"": 182147, ""name"": ""underwater photography""}, {""id"": 182148, ""name"": ""bouncy castle""}, {""id"": 182163, ""name"": ""flash grenade""}]",en,Project X,"Three high school seniors throw a party to make a name for themselves. As the night progresses, things spiral out of control as word of the party spreads.",49.070321,"[{""name"": ""Silver Pictures"", ""id"": 1885}, {""name"": ""Green Hat Films"", ""id"": 3527}]","[{""iso_3166_1"": ""US"", ""name"": ""United States of America""}]",3/1/2012,100000000,88,"[{""iso_639_1"": ""en"", ""name"": ""English""}]",Released,Witness it,Project X,6.5,1564
30000000,"[{""id"": 53, ""name"": ""Thriller""}, {""id"": 80, ""name"": ""Crime""}, {""id"": 18, ""name"": ""Drama""}]",http://www.prideandglorymovie.com/,13150,"[{""id"": 467, ""name"": ""megacity""}, {""id"": 2102, ""name"": ""brother-in-law""}, {""id"": 6149, ""name"": ""police""}]",en,Pride and Glory,"A saga centered on a multi-generational family of New York City Police officers. The family's moral codes are tested when Ray Tierney, investigates a case that reveals an incendiary police corruption scandal involving his own brother-in-law. For Ray, the truth is revelatory, a Pandora's Box that threatens to upend not only the Tierney legacy but the entire NYPD.",10.703602,"[{""name"": ""New Line Cinema"", ""id"": 12}, {""name"": ""Solaris Film"", ""id"": 1001}, {""name"": ""Avery Pix"", ""id"": 1565}, {""name"": ""O'Connor Brothers"", ""id"": 12066}, {""name"": ""Kumar Mobiliengesellschaft mbH & Co. Projekt Nr. 1 KG"", ""id"": 12067}]","[{""iso_3166_1"": ""US"", ""name"": ""United States of America""}, {""iso_3166_1"": ""DE"", ""name"": ""Germany""}]",9/9/2008,31148328,130,"[{""iso_639_1"": ""en"", ""name"": ""English""}]",Released,Truth. Honor. Loyalty. Family. What are you willing to sacrifice?,Pride and Glory,6.3,240
