budget,genres,homepage,id,keywords,original_language,original_title,overview,popularity,production_companies,production_countries,release_date,revenue,runtime,spoken_languages,status,tagline,title,vote_average,vote_count
2400000,"[{""id"": 18, ""name"": ""Drama""}]",,49471,"[{""id"": 521, ""name"": ""washington d.c.""}, {""id"": 992, ""name"": ""bus""}, {""id"": 165461, ""name"": ""march""}]",en,Get on the Bus,"Get On the Bus follows several Black men on a cross country bus trip to the Million Man March. On the bus are an eclectic set of characters including a laid off aircraft worker, a former Gang Banger, a Hollywood actor, a cop who is of mixed racial background, and a White bus driver, all make the trek discussing issues surrounding the march, manhood, religion, politics, and race.",4.623059,"[{""name"": ""Columbia Pictures"", ""id"": 5}, {""name"": ""40 Acres & A Mule Filmworks"", ""id"": 4319}]","[{""iso_3166_1"": ""US"", ""name"": ""United States of America""}]",10/16/1996,5731103,120,"[{""iso_639_1"": ""en"", ""name"": ""English""}]",Released,"On October 16, 1996, the one year anniversary of the Million Man March, Spike Lee invites you to lift your head, raise your voice, and...get on the bus.",Get on the Bus,7,11
50000000,"[{""id"": 80, ""name"": ""Crime""}, {""id"": 53, ""name"": ""Thriller""}]",,181283,"[{""id"": 818, ""name"": ""based on novel""}, {""id"": 2111, ""name"": ""soviet union""}, {""id"": 2808, ""name"": ""russian""}, {""id"": 9826, ""name"": ""murder""}, {""id"": 10714, ""name"": ""serial killer""}, {""id"": 162365, ""name"": ""military""}, {""id"": 166109, ""name"": ""child murder""}, {""id"": 191543, ""name"": ""stalinism""}, {""id"": 208611, ""name"": ""1950s""}]",en,Child 44,"Set in Stalin-era Soviet Union, a disgraced MGB agent is dispatched to investigate a series of child murders -- a case that begins to connect with the very top of party leadership.",40.371098,"[{""name"": ""Summit Entertainment"", ""id"": 491}, {""name"": ""Scott Free Productions"", ""id"": 1645}, {""name"": ""Worldview Entertainment"", ""id"": 9015}]","[{""iso_3166_1"": ""GB"", ""name"": ""United Kingdom""}, {""iso_3166_1"": ""US"", ""name"": ""United States of America""}, {""iso_3166_1"": ""CZ"", ""name"": ""Czech Republic""}, {""iso_3166_1"": ""RO"", ""name"": ""Romania""}]",3/15/2015,3324330,137,"[{""iso_639_1"": ""en"", ""name"": ""English""}]",Released,How do you find a killer who doesn’t exist?,Child 44,6.1,547
40000000,"[{""id"": 10749, ""name"": ""Romance""}, {""id"": 14, ""name"": ""Fantasy""}, {""id"": 16, ""name"": ""Animation""}, {""id"": 10402, ""name"": ""Music""}]",http://corpsebridemovie.warnerbros.com/,3933,"[{""id"": 367, ""name"": ""shyness""}, {""id"": 392, ""name"": ""england""}, {""id"": 1332, ""name"": ""cheating""}, {""id"": 2103, ""name"": ""old town""}, {""id"": 2968, ""name"": ""grave""}, {""id"": 4062, ""name"": ""skeleton""}, {""id"": 4344, ""name"": ""musical""}, {""id"": 6038, ""name"": ""marriage""}, {""id"": 7578, ""name"": ""wedding ring""}, {""id"": 10121, ""name"": ""stop motion""}, {""id"": 10336, ""name"": ""animation""}, {""id"": 10594, ""name"": ""money""}, {""id"": 13027, ""name"": ""wedding""}, {""id"": 13092, ""name"": ""corpse""}, {""id"": 18093, ""name"": ""wedding ceremony""}, {""id"": 159947, ""name"": ""parents""}, {""id"": 177895, ""name"": ""dark fantasy""}, {""id"": 181046, ""name"": ""european""}, {""id"": 189093, ""name"": ""ring""}, {""id"": 207592, ""name"": ""piano""}]",en,Corpse Bride,"Set in a 19th-century european village, this stop-motion animation feature follows the story of Victor, a young man whisked away to the underworld and wed to a mysterious corpse bride, while his real bride Victoria waits bereft in the land of the living.",43.571612,"[{""name"": ""Tim Burton Animation Company"", ""id"": 1514}, {""name"": ""Will Vinton Studios"", ""id"": 1515}, {""name"": ""Warner Bros."", ""id"": 6194}, {""name"": ""Tim Burton Productions"", ""id"": 8601}, {""name"": ""Laika Entertainment"", ""id"": 11537}, {""name"": ""Patalex Productions"", ""id"": 57751}]","[{""iso_3166_1"": ""US"", ""name"": ""United States of America""}]",9/9/2005,117195061,77,"[{""iso_639_1"": ""en"", ""name"": ""English""}]",Released,There's been a grave misunderstanding.,Corpse Bride,7.2,1894
90000000,"[{""id"": 80, ""name"": ""Crime""}, {""id"": 53, ""name"": ""Thriller""}, {""id"": 18, ""name"": ""Drama""}]",,4477,"[{""id"": 242, ""name"": ""new york""}, {""id"": 949, ""name"": ""terrorist""}, {""id"": 2142, ""name"": ""anonymity""}, {""id"": 7005, ""name"": ""northern ireland""}]",en,The Devil's Own,"Frankie McGuire, one of the IRA's deadliest assassins, draws an American family into the crossfire of terrorism. But when he is sent to the U.S. to buy weapons, Frankie is housed with the family of Tom O'Meara, a New York cop who knows nothing about Frankie's real identity. Their surprising friendship, and Tom's growing suspicions, forces Frankie to choose between the promise of peace or a lifetime of murder.",15.350451,"[{""name"": ""Columbia Pictures"", ""id"": 5}]","[{""iso_3166_1"": ""US"", ""name"": ""United States of America""}]",3/12/1997,140807547,107,"[{""iso_639_1"": ""en"", ""name"": ""English""}]",Released,"They come from different worlds. They fight for different causes. Now, two men from opposite sides of the law are about to go to war.",The Devil's Own,5.9,290
50000000,"[{""id"": 28, ""name"": ""Action""}, {""id"": 53, ""name"": ""Thriller""}, {""id"": 9648, ""name"": ""Mystery""}, {""id"": 10749, ""name"": ""Romance""}]",,11863,"[{""id"": 550, ""name"": ""callgirl""}, {""id"": 582, ""name"": ""san francisco""}, {""id"": 5340, ""name"": ""investigation""}, {""id"": 9826, ""name"": ""murder""}]",en,Jade,"Someone does a nasty hatchet job on a San Fransisco big noise and the Assistant D.A. takes charge of the investigation. Through a web of blackmail and prostitution involving the Governor, an old lover of the law man emerges as a prime suspect and he has to deal with his personal feelings as well as the case.",8.189406,"[{""name"": ""Paramount Pictures"", ""id"": 4}]","[{""iso_3166_1"": ""US"", ""name"": ""United States of America""}]",10/13/1995,9851610,95,"[{""iso_639_1"": ""en"", ""name"": ""English""}]",Released,Some fantasies go too far.,Jade,5.2,44
25000000,"[{""id"": 10749, ""name"": ""Romance""}, {""id"": 18, ""name"": ""Drama""}, {""id"": 35, ""name"": ""Comedy""}]",,1909,"[{""id"": 5906, ""name"": ""sex addiction""}, {""id"": 9673, ""name"": ""love""}, {""id"": 11857, ""name"": ""mental institution""}, {""id"": 14781, ""name"": ""patient""}, {""id"": 15106, ""name"": ""psychiatrist""}, {""id"": 180077, ""name"": ""don juan""}]",en,Don Juan DeMarco,"John Arnold DeMarco is a man who believes he is Don Juan, the greatest lover in the world. Clad in a cape and mask, DeMarco undergoes psychiatric treatment with Dr. Jack Mickler to cure him of his apparent delusion. But the psychiatric sessions have an unexpected effect on the psychiatric staff and, most profoundly, Dr Mickler, who rekindles the romance in his complacent marriage.",8.870614,"[{""name"": ""New Line Cinema"", ""id"": 12}, {""name"": ""American Zoetrope"", ""id"": 70}]","[{""iso_3166_1"": ""US"", ""name"": ""United States of America""}]",10/1/1994,22200000,97,"[{""iso_639_1"": ""en"", ""name"": ""English""}]",Released,The story of the man who thought he was the greatest lover in the world... and the people who tried to cure him of it!,Don Juan DeMarco,6.2,183
75000000,"[{""id"": 28, ""name"": ""Action""}, {""id"": 12, ""name"": ""Adventure""}, {""id"": 35, ""name"": ""Comedy""}]",,6415,"[{""id"": 1321, ""name"": ""gold""}, {""id"": 2952, ""name"": ""gulf war""}, {""id"": 3570, ""name"": ""three kings""}, {""id"": 5939, ""name"": ""iraq""}, {""id"": 8651, ""name"": ""kuwait""}, {""id"": 10084, ""name"": ""rescue""}, {""id"": 10131, ""name"": ""interracial relationship""}, {""id"": 11088, ""name"": ""treasure map""}, {""id"": 13065, ""name"": ""soldier""}, {""id"": 33564, ""name"": ""u.s. soldier""}, {""id"": 159859, ""name"": ""gold theft""}, {""id"": 168818, ""name"": ""persian gulf""}, {""id"": 168835, ""name"": ""emergency surgery""}, {""id"": 168839, ""name"": ""mine field""}]",en,Three Kings,"A group of American soldiers stationed in Iraq at the end of the Gulf War find a map they believe will take them to a huge cache of stolen Kuwaiti gold hidden near their base, and they embark on a secret mission that's destined to change everything.",34.973086,"[{""name"": ""Village Roadshow Pictures"", ""id"": 79}, {""name"": ""Atlas Entertainment"", ""id"": 507}, {""name"": ""Warner Bros."", ""id"": 6194}, {""name"": ""Village-A.M. Partnership"", ""id"": 23689}, {""name"": ""Coast Ridge"", ""id"": 23690}, {""name"": ""Junger Witt Productions"", ""id"": 23691}]","[{""iso_3166_1"": ""US"", ""name"": ""United States of America""}]",9/27/1999,108000000,114,"[{""iso_639_1"": ""en"", ""name"": ""English""}, {""iso_639_1"": ""ar"", ""name"": ""\u0627\u0644\u0639\u0631\u0628\u064a\u0629""}]",Released,It's good to be King.,Three Kings,6.6,692
55000000,"[{""id"": 18, ""name"": ""Drama""}]",http://www.sonypictures.com/movies/sevenpounds/,11321,"[{""id"": 4459, ""name"": ""vegetarian""}, {""id"": 9368, ""name"": ""tax collector""}, {""id"": 14743, ""name"": ""pianist""}, {""id"": 33768, ""name"": ""blind""}, {""id"": 33773, ""name"": ""organ transplant""}, {""id"": 33774, ""name"": ""blood type""}]",en,Seven Pounds,An IRS agent with a fateful secret embarks on an extraordinary journey of redemption by forever changing the lives of seven strangers.,41.472404,"[{""name"": ""Columbia Pictures"", ""id"": 5}, {""name"": ""Escape Artists"", ""id"": 1423}, {""name"": ""Relativity Media"", ""id"": 7295}, {""name"": ""Overbrook Entertainment"", ""id"": 12485}]","[{""iso_3166_1"": ""US"", ""name"": ""United States of America""}]",12/18/2008,168167691,123,"[{""iso_639_1"": ""en"", ""name"": ""English""}, {""iso_639_1"": ""es"", ""name"": ""Espa\u00f1ol""}]",Released,Seven names. Seven strangers. One secret.,Seven Pounds,7.5,2039
4800000,"[{""id"": 27, ""name"": ""Horror""}]",http://www.hostelfilm.com/,1690,"[{""id"": 472, ""name"": ""bathroom""}, {""id"": 572, ""name"": ""sex""}, {""id"": 587, ""name"": ""amsterdam""}, {""id"": 1295, ""name"": ""europe""}, {""id"": 1411, ""name"": ""brothel""}, {""id"": 5689, ""name"": ""slovakia""}, {""id"": 5891, ""name"": ""backpacker""}, {""id"": 8087, ""name"": ""horror""}, {""id"": 10292, ""name"": ""gore""}, {""id"": 11221, ""name"": ""blood""}, {""id"": 13006, ""name"": ""torture""}, {""id"": 155955, ""name"": ""business card""}, {""id"": 156149, ""name"": ""doberman""}, {""id"": 157958, ""name"": ""hostel""}, {""id"": 157959, ""name"": ""surgery""}, {""id"": 198438, ""name"": ""elite club""}, {""id"": 198441, ""name"": ""fingers""}]",en,Hostel,"Three backpackers head to a Slovakian city that promises to meet their hedonistic expectations, with no idea of the hell that awaits them.",38.83192,"[{""name"": ""International Production Company"", ""id"": 1507}, {""name"": ""Raw Nerve"", ""id"": 1631}, {""name"": ""Lionsgate"", ""id"": 1632}, {""name"": ""Next Entertainment"", ""id"": 1633}, {""name"": ""Screen Gems"", ""id"": 3287}, {""name"": ""Hostel LLC"", ""id"": 17793}]","[{""iso_3166_1"": ""US"", ""name"": ""United States of America""}]",1/6/2005,80578934,94,"[{""iso_639_1"": ""en"", ""name"": ""English""}]",Released,Welcome To Your Worst Nightmare,Hostel,5.7,887
25000000,"[{""id"": 80, ""name"": ""Crime""}, {""id"": 53, ""name"": ""Thriller""}]",https://www.uphe.com/movies/legend-2015,276907,"[{""id"": 5565, ""name"": ""biography""}, {""id"": 9672, ""name"": ""based on true story""}, {""id"": 13142, ""name"": ""gangster""}, {""id"": 15016, ""name"": ""twins""}]",en,Legend,"Suave, charming and volatile, Reggie Kray and his unstable twin brother Ronnie start to leave their mark on the London underworld in the 1960s. Using violence to get what they want, the siblings orchestrate robberies and murders while running nightclubs and protection rackets. With police Detective Leonard ""Nipper"" Read hot on their heels, the brothers continue their rapid rise to power and achieve tabloid notoriety.",32.854557,"[{""name"": ""Working Title Films"", ""id"": 10163}, {""name"": ""Cross Creek Pictures"", ""id"": 10246}, {""name"": ""Anton Capital Entertainment (ACE)"", ""id"": 20664}]","[{""iso_3166_1"": ""GB"", ""name"": ""United Kingdom""}, {""iso_3166_1"": ""US"", ""name"": ""United States of America""}, {""iso_3166_1"": ""FR"", ""name"": ""France""}]",9/9/2015,42972994,131,"[{""iso_639_1"": ""en"", ""name"": ""English""}]",Released,"Love, fight, live, rule like a legend.",Legend,6.7,973
24000000,"[{""id"": 35, ""name"": ""Comedy""}]",http://www.oldschool-themovie.com,11635,"[{""id"": 171134, ""name"": ""sex doll""}, {""id"": 171143, ""name"": ""streaking""}, {""id"": 171150, ""name"": ""mouth to mouth resuscitation""}]",en,Old School,Three friends attempt to recapture their glory days by opening up a fraternity near their alma mater.,24.70166,"[{""name"": ""DreamWorks SKG"", ""id"": 27}, {""name"": ""The Montecito Picture Company"", ""id"": 2364}]","[{""iso_3166_1"": ""US"", ""name"": ""United States of America""}]",2/21/2003,87055349,91,"[{""iso_639_1"": ""en"", ""name"": ""English""}]",Released,"All the fun of college, none of the education.",Old School,6.6,541
12000000,"[{""id"": 878, ""name"": ""Science Fiction""}, {""id"": 53, ""name"": ""Thriller""}]",http://www.projectalmanac.com/,227719,"[{""id"": 4379, ""name"": ""time travel""}, {""id"": 5455, ""name"": ""time machine""}, {""id"": 13130, ""name"": ""teenager""}, {""id"": 163053, ""name"": ""found footage""}]",en,Project Almanac,"A group of teens discover secret plans of a time machine, and construct one. However, things start to get out of control.",32.940597,"[{""name"": ""Paramount Pictures"", ""id"": 4}, {""name"": ""MTV Films"", ""id"": 746}, {""name"": ""Platinum Dunes"", ""id"": 2481}, {""name"": ""Insurge Pictures"", ""id"": 7377}]","[{""iso_3166_1"": ""US"", ""name"": ""United States of America""}]",1/30/2015,32248241,106,"[{""iso_639_1"": ""en"", ""name"": ""English""}]",Released,Today is better the second time around,Project Almanac,6.4,933
4000000,"[{""id"": 35, ""name"": ""Comedy""}]",,10246,"[{""id"": 255, ""name"": ""male nudity""}, {""id"": 293, ""name"": ""female nudity""}, {""id"": 572, ""name"": ""sex""}, {""id"": 1196, ""name"": ""florida""}, {""id"": 2389, ""name"": ""virgin""}, {""id"": 2483, ""name"": ""nudity""}, {""id"": 6593, ""name"": ""stripper""}, {""id"": 10250, ""name"": ""redneck""}, {""id"": 10873, ""name"": ""school""}, {""id"": 11254, ""name"": ""loss of virginity""}, {""id"": 12011, ""name"": ""hijinks""}, {""id"": 12425, ""name"": ""racism""}, {""id"": 13130, ""name"": ""teenager""}, {""id"": 14794, ""name"": ""lust""}, {""id"": 15075, ""name"": ""mischief""}, {""id"": 156391, ""name"": ""peeping tom""}, {""id"": 161266, ""name"": ""teaching""}, {""id"": 161267, ""name"": ""misadventure""}, {""id"": 179431, ""name"": ""duringcreditsstinger""}, {""id"": 180340, ""name"": ""voyeur""}, {""id"": 206850, ""name"": ""canuxploitation""}, {""id"": 208445, ""name"": ""virginity""}]",en,Porky's,"Set in 1954, a group of Florida high schoolers seek out to lose their virginity which leads them to seek revenge on a sleazy nightclub owner and his redneck sheriff brother for harassing them.",12.891276,"[{""name"": ""Melvin Simon Productions"", ""id"": 2124}, {""name"": ""Astral Bellevue Path\u00e9"", ""id"": 10313}]","[{""iso_3166_1"": ""US"", ""name"": ""United States of America""}, {""iso_3166_1"": ""CA"", ""name"": ""Canada""}]",11/13/1981,125728258,94,"[{""iso_639_1"": ""en"", ""name"": ""English""}]",Released,Keep an eye out for the funniest movie about growing up ever made!,Porky's,6.1,183
70000000,"[{""id"": 10749, ""name"": ""Romance""}, {""id"": 35, ""name"": ""Comedy""}, {""id"": 12, ""name"": ""Adventure""}]",http://www.warnerbros.com/fools-gold,8676,"[{""id"": 720, ""name"": ""helicopter""}, {""id"": 1227, ""name"": ""cemetery""}, {""id"": 1422, ""name"": ""boat""}, {""id"": 1666, ""name"": ""mexican standoff""}, {""id"": 1938, ""name"": ""sword""}, {""id"": 1964, ""name"": ""cave""}, {""id"": 2580, ""name"": ""shipwreck""}, {""id"": 3342, ""name"": ""yacht""}, {""id"": 3345, ""name"": ""bahamas""}, {""id"": 3468, ""name"": ""jet ski""}, {""id"": 6956, ""name"": ""treasure hunt""}, {""id"": 9823, ""name"": ""rivalry""}, {""id"": 10503, ""name"": ""scuba diving""}, {""id"": 13142, ""name"": ""gangster""}, {""id"": 14785, ""name"": ""underwater""}, {""id"": 15160, ""name"": ""divorce""}, {""id"": 41185, ""name"": ""heiress""}, {""id"": 163758, ""name"": ""ex-husband ex-wife relationship""}, {""id"": 194943, ""name"": ""henchmen""}]",en,Fool's Gold,"Treasure hunter Ben ""Finn"" Finnegan has sunk his marriage to Tess and his trusty boat in his obsessive quest to find the legendary Queen's Dowry. When he finds a vital clue that may finally pinpoint the treasure's whereabouts, he drags Tess and her boss, billionaire Nigel Honeycutt, along on the hunt. But Finn is not the only one interested in the gold; his former mentor-turned-enemy Moe Fitch will stop at nothing to beat him to it.",21.789615,"[{""name"": ""De Line Pictures"", ""id"": 2609}, {""name"": ""Warner Bros."", ""id"": 6194}]","[{""iso_3166_1"": ""US"", ""name"": ""United States of America""}]",2/7/2008,111231041,112,"[{""iso_639_1"": ""en"", ""name"": ""English""}]",Released,This February True Love Takes a Dive.,Fool's Gold,5.4,444
30000000,"[{""id"": 28, ""name"": ""Action""}, {""id"": 80, ""name"": ""Crime""}, {""id"": 53, ""name"": ""Thriller""}]",http://www.safethefilm.com/,72387,"[{""id"": 180366, ""name"": ""broken trachea""}]",en,Safe,"After a former elite agent rescues a 12-year-old Chinese girl who's been abducted, they find themselves in the middle of a standoff between Triads, the Russian Mafia and high-level corrupt New York City politicians and police.",31.92695,"[{""name"": ""Lawrence Bender Productions"", ""id"": 2253}, {""name"": ""IM Global"", ""id"": 7437}, {""name"": ""Automatik Entertainment"", ""id"": 7625}, {""name"": ""Trigger Street Productions"", ""id"": 11801}, {""name"": ""87Eleven"", ""id"": 23008}]","[{""iso_3166_1"": ""US"", ""name"": ""United States of America""}]",4/16/2012,40346186,94,"[{""iso_639_1"": ""en"", ""name"": ""English""}, {""iso_639_1"": ""zh"", ""name"": ""\u666e\u901a\u8bdd""}, {""iso_639_1"": ""ru"", ""name"": ""P\u0443\u0441\u0441\u043a\u0438\u0439""}]",Released,She has the code. He is the key.,Safe,6.3,799
10000000,"[{""id"": 14, ""name"": ""Fantasy""}, {""id"": 35, ""name"": ""Comedy""}, {""id"": 12, ""name"": ""Adventure""}]",http://www.dogma-movie.com/,1832,"[{""id"": 290, ""name"": ""angel""}, {""id"": 2024, ""name"": ""wisconsin""}, {""id"": 4636, ""name"": ""church service""}, {""id"": 14765, ""name"": ""church""}, {""id"": 179430, ""name"": ""aftercreditsstinger""}, {""id"": 179431, ""name"": ""duringcreditsstinger""}]",en,Dogma,"The latest battle in the eternal war between Good and Evil has come to New Jersey in the late, late 20th Century. Angels, demons, apostles and prophets (of a sort) walk among the cynics and innocents of America and duke it out for the fate of humankind.",14.543435,"[{""name"": ""Lions Gate"", ""id"": 6644}, {""name"": ""View Askew Productions"", ""id"": 16934}]","[{""iso_3166_1"": ""US"", ""name"": ""United States of America""}]",11/12/1999,30652890,130,"[{""iso_639_1"": ""en"", ""name"": ""English""}]",Released,It can be Hell getting into Heaven,Dogma,6.8,823
33000000,"[{""id"": 28, ""name"": ""Action""}, {""id"": 27, ""name"": ""Horror""}, {""id"": 9648, ""name"": ""Mystery""}, {""id"": 878, ""name"": ""Science Fiction""}, {""id"": 53, ""name"": ""Thriller""}]",http://www.pandorummovie.com/,19898,"[{""id"": 4565, ""name"": ""dystopia""}, {""id"": 9831, ""name"": ""spaceship""}, {""id"": 10349, ""name"": ""survival""}, {""id"": 10364, ""name"": ""mission""}]",en,Pandorum,"Two crew members wake up on an abandoned spacecraft with no idea who they are, how long they've been asleep, or what their mission is. The two soon discover they're actually not alone – and the reality of their situation is more horrifying than they could have imagined.",28.353517,"[{""name"": ""Impact Pictures"", ""id"": 248}, {""name"": ""Constantin Film Produktion"", ""id"": 5755}]","[{""iso_3166_1"": ""DE"", ""name"": ""Germany""}, {""iso_3166_1"": ""GB"", ""name"": ""United Kingdom""}]",9/8/2009,20645327,108,"[{""iso_639_1"": ""en"", ""name"": ""English""}, {""iso_639_1"": ""vi"", ""name"": ""Ti\u1ebfng Vi\u1ec7t""}, {""iso_639_1"": ""de"", ""name"": ""Deutsch""}]",Released,Don't fear the end of the world. Fear what happens next.,Pandorum,6.5,774
100000000,"[{""id"": 53, ""name"": ""Thriller""}, {""id"": 878, ""name"": ""Science Fiction""}, {""id"": 28, ""name"": ""Action""}, {""id"": 12, ""name"": ""Adventure""}]",,869,"[{""id"": 690, ""name"": ""gorilla""}, {""id"": 1826, ""name"": ""space marine""}, {""id"": 1828, ""name"": ""space suit""}, {""id"": 2020, ""name"": ""revolution""}, {""id"": 2552, ""name"": ""chimp""}, {""id"": 2831, ""name"": ""slavery""}, {""id"": 3801, ""name"": ""space travel""}, {""id"": 4379, ""name"": ""time travel""}, {""id"": 4565, ""name"": ""dystopia""}, {""id"": 10158, ""name"": ""alien planet""}, {""id"": 14759, ""name"": ""ape""}, {""id"": 207569, ""name"": ""human subjugation""}]",en,Planet of the Apes,"After a spectacular crash-landing on an uncharted planet, brash astronaut Leo Davidson finds himself trapped in a savage world where talking apes dominate the human race. Desperate to find a way home, Leo must evade the invincible gorilla army led by Ruthless General Thade.",51.188633,"[{""name"": ""Twentieth Century Fox Film Corporation"", ""id"": 306}, {""name"": ""Tim Burton Productions"", ""id"": 8601}, {""name"": ""Zanuck Company, The"", ""id"": 20004}]","[{""iso_3166_1"": ""US"", ""name"": ""United States of America""}]",7/25/2001,362211740,119,"[{""iso_639_1"": ""en"", ""name"": ""English""}]",Released,You'll be sorry you were ever born human,Planet of the Apes,5.6,1243
120000000,"[{""id"": 35, ""name"": ""Comedy""}, {""id"": 18, ""name"": ""Drama""}, {""id"": 10749, ""name"": ""Romance""}]",http://www.howdoyouknow-movie.com/,42888,"[{""id"": 128, ""name"": ""love triangle""}, {""id"": 1480, ""name"": ""baseball""}, {""id"": 10456, ""name"": ""athlete""}, {""id"": 179430, ""name"": ""aftercreditsstinger""}]",en,How Do You Know,"After being cut from the USA softball team and feeling a bit past her prime, Lisa finds herself evaluating her life and in the middle of a love triangle, as a corporate guy in crisis competes with her current, baseball-playing beau.",11.137655,"[{""name"": ""Columbia Pictures"", ""id"": 5}, {""name"": ""Gracie Films"", ""id"": 18}, {""name"": ""Road Rebel"", ""id"": 2648}]","[{""iso_3166_1"": ""US"", ""name"": ""United States of America""}]",12/17/2010,48668907,121,"[{""iso_639_1"": ""en"", ""name"": ""English""}]",Released,How do you know it's love?,How Do You Know,4.9,223
2000000,"[{""id"": 18, ""name"": ""Drama""}, {""id"": 10402, ""name"": ""Music""}, {""id"": 10749, ""name"": ""Romance""}]",,43839,"[{""id"": 1691, ""name"": ""dance""}, {""id"": 167411, ""name"": ""ragtime""}, {""id"": 225156, ""name"": ""concert tour""}]",en,Alexander's Ragtime Band,"Roger Grant, a classical violinist, disappoints his family and teacher when he organizes a jazz band, but he and the band become successful. Roger falls in love with his singer Stella, but his reluctance to lose her leads him to thwart her efforts to become a solo star. When the World War separates them in 1917, Stella marries Roger's best friend Charlie. Roger comes home after the war and an important concert at Carnegie Hall brings the corners of the romantic triangle together.",0.483974,"[{""name"": ""Twentieth Century Fox Film Corporation"", ""id"": 306}]","[{""iso_3166_1"": ""US"", ""name"": ""United States of America""}]",5/24/1938,4000000,106,"[{""iso_639_1"": ""en"", ""name"": ""English""}]",Released,An American Cavalcade!,Alexander's Ragtime Band,4.8,6
50000000,"[{""id"": 28, ""name"": ""Action""}, {""id"": 53, ""name"": ""Thriller""}]",,216282,"[{""id"": 2213, ""name"": ""tornado""}, {""id"": 12105, ""name"": ""student""}, {""id"": 163053, ""name"": ""found footage""}, {""id"": 199076, ""name"": ""disaster movie""}]",en,Into the Storm,"The town of Silverton is in one day destroyed by the unprecedented power of a series of tornadoes. The population is at the mercy of the unpredictable and deadly cyclones, while hunters warn that the worst is yet to come. Most people find shelter, but some just go to the tornado for that one, unique shot.",20.566554,"[{""name"": ""New Line Cinema"", ""id"": 12}, {""name"": ""Village Roadshow Pictures"", ""id"": 79}, {""name"": ""Broken Road Productions"", ""id"": 8000}, {""name"": ""RatPac-Dune Entertainment"", ""id"": 41624}]","[{""iso_3166_1"": ""US"", ""name"": ""United States of America""}]",8/6/2014,160602194,89,"[{""iso_639_1"": ""en"", ""name"": ""English""}]",Released,Prepare to go,Into the Storm,5.8,817
